{
  "hearingId": "7755fb96-e90a-4df2-8575-47841d8fbdd0",
  "courtScheduleId": "5e2a3f91-9e5d-3e44-b664-d5345bb13be2",
  "courtRoomId": 731816,
  "sessionDate": "2026-04-21",
  "sessionStartTime": "2026-04-21T09:00:00Z",
  "sessionEndTime": "2026-04-21T17:00:00Z",
  "durationInMinutes": 10,
  "isDraft": false,
  "businessType": "CR",
  "source": "CROWN_FB_LIST",
  "overbooked": false
}
